{
  "schemaVersion":1,"dataMode":"live","date":"2026-09-03","generatedAt":"2026-09-02T16:07:00.000Z","timezone":"Asia/Shanghai",
  "summary":{"topicCount":8,"urgentCount":2,"crossPlatformCount":4,"formulaReadyCount":8},
  "sourceStatus":[{"id":"douyin","name":"抖音","status":"fresh","items":49,"updatedAt":"2026-09-02T16:05:21.908Z"},{"id":"weibo","name":"微博","status":"fresh","items":50,"updatedAt":"2026-09-02T16:05:21.908Z"},{"id":"zhihu","name":"知乎","status":"partial","items":30,"updatedAt":"2026-09-02T16:05:21.908Z"},{"id":"xiaohongshu","name":"小红书","status":"partial","items":10,"updatedAt":"2026-09-02T16:05:21.908Z"},{"id":"baidu","name":"百度","status":"fresh","items":50,"updatedAt":"2026-09-02T16:05:21.908Z"},{"id":"bilibili","name":"B站","status":"fresh","items":50,"updatedAt":"2026-09-02T16:05:21.908Z"}],
  "trendHistory":{"times":["2026-08-27","2026-08-28","2026-08-29","2026-08-30","2026-09-01","2026-09-02","2026-09-03"],"series":{"douyin":[96,96,96,100,98,98,98],"weibo":[100,100,100,100,100,100,100],"zhihu":[60,60,60,60,60,60,60],"xiaohongshu":[20,20,20,20,20,20,20],"baidu":[100,100,100,100,100,100,100],"bilibili":[100,100,100,100,100,100,100]}},
  "topics":[
    {"id":"jilong-landslide-information-safety","rank":1,"title":"吉隆泥石流：灾情内容先核验，不转述数字","brief":"吉隆泥石流同时出现在抖音、微博、知乎、百度和B站原榜。原榜只证明讨论度，不足以确认灾情细节；内容宜教观众查看发布机构、发布时间和更新时点，不应复述伤亡或失联数字。","category":"公共安全","momentum":"peak","urgency":"now","heat":100,"crossPlatform":5,"mathFit":96,"visualFit":82,"lifeFit":98,"questionDensity":98,"priority":99,"platforms":[{"id":"douyin","rank":2,"score":99,"trend":"高位"},{"id":"zhihu","rank":5,"score":95,"trend":"热议"},{"id":"baidu","rank":6,"score":94,"trend":"高位"},{"id":"weibo","rank":7,"score":92,"trend":"热议"},{"id":"bilibili","rank":11,"score":87,"trend":"讨论"}],"keywords":["吉隆","泥石流","灾情","信息核验"],"mathAngles":["把消息拆成来源、发布时间、更新时间和可行动信息四栏","用时间线解释滚动灾情为何出现不同数字","明确区分通报、现场转述与截图"],"hooks":["灾情越紧急，越不能只转一张截图","看到数字时先找三个时间信息"],"recommendedFormat":{"duration":"40–60 秒","structure":"风险提醒 → 信息卡模板 → 权威入口提示"},"factStatus":"blocked","sources":[{"name":"抖音热榜：西藏泥石流","url":"https://www.douyin.com/search/%E8%A5%BF%E8%97%8F%E6%B3%A5%E7%9F%B3%E6%B5%8121%E4%BA%BA%E9%81%87%E9%9A%BE541%E4%BA%BA%E5%A4%B1%E8%81%94","type":"platform"},{"name":"B站热门：吉隆救援核心区","url":"https://www.bilibili.com/video/BV1V2tJ6DEfH","type":"platform"}],"updatedAt":"2026-09-02T16:07:00.000Z"},
    {"id":"rainfall-typhoon-action-checklist","rank":2,"title":"强降雨与台风：把风险提示拍成行动清单","brief":"强降雨和台风影响相关话题占据抖音与百度原榜。天气、出行和本地生活创作者可制作“出门前怎么查、暴雨时怎么避、何时停止出行”的清单；预警等级和停课信息须回到当地部门最新发布。","category":"天气与出行","momentum":"peak","urgency":"now","heat":97,"crossPlatform":2,"mathFit":92,"visualFit":91,"lifeFit":98,"questionDensity":94,"priority":97,"platforms":[{"id":"douyin","rank":5,"score":95,"trend":"高位"},{"id":"baidu","rank":38,"score":59,"trend":"讨论"}],"keywords":["强降雨","台风","出行安全","预警"],"mathAngles":["用预警、位置、出发时间和替代方案做四步检查","在画面中标注发布机构和时次","把交通、积水和风力作为并列风险"],"hooks":["暴雨天最有用的不是围观雨有多大","出门前30秒先查这四项"],"recommendedFormat":{"duration":"45–70 秒","structure":"热榜场景 → 四步检查 → 官方预警入口"},"factStatus":"needs-review","sources":[{"name":"抖音热榜：台风沙德尔","url":"https://www.douyin.com/search/%E5%8F%B0%E9%A3%8E%E6%B2%99%E5%BE%B7%E5%B0%94%E6%88%96%E7%99%BB%E9%99%86%E7%B2%A4%E4%B8%9C%E6%B2%BF%E6%B5%B7","type":"platform"},{"name":"百度热榜：泉州停课停工","url":"https://m.baidu.com/s?word=%E7%A6%8F%E5%BB%BA%E6%B3%89%E5%B7%9E%E5%85%A8%E5%B8%82%E5%81%9C%E8%AF%BE%E5%81%9C%E5%B7%A5%E6%99%AF%E5%8C%BA%E5%85%B3%E9%97%AD&sa=fyb_news","type":"platform"}],"updatedAt":"2026-09-02T16:07:00.000Z"},
    {"id":"wechat-accessibility-features","rank":3,"title":"微信新功能热议：无障碍体验怎样真正被看见","brief":"“微信新功能专治各种看不见”位居微博榜首。适合产品、生活方式和公共议题创作者从字体、对比度、语音反馈和真实使用场景讲无障碍，不对具体功能范围作未经官方确认的推断。","category":"产品与生活","momentum":"peak","urgency":"today","heat":93,"crossPlatform":1,"mathFit":90,"visualFit":85,"lifeFit":96,"questionDensity":93,"priority":93,"platforms":[{"id":"weibo","rank":1,"score":100,"trend":"高位"}],"keywords":["微信","无障碍","可见性","产品体验"],"mathAngles":["用完成一项任务所需步骤比较体验","将字体、对比度、反馈和容错列成体验清单","邀请真实用户演示而非代替他们发言"],"hooks":["一项看似小的功能，谁终于能正常使用","好产品不是让所有人都用一样的方式"],"recommendedFormat":{"duration":"40–65 秒","structure":"场景开场 → 四项体验卡 → 官方说明核对"},"factStatus":"needs-review","sources":[{"name":"微博热搜：微信新功能","url":"https://s.weibo.com/weibo?q=%23%E5%BE%AE%E4%BF%A1%E6%96%B0%E5%8A%9F%E8%83%BD%E4%B8%93%E6%B2%BB%E5%90%84%E7%A7%8D%E7%9C%8B%E4%B8%8D%E8%A7%81%23","type":"platform"}],"updatedAt":"2026-09-02T16:07:00.000Z"},
    {"id":"thermos-material-verification","rank":4,"title":"保温杯钢印造假：消费科普先教人核验","brief":"央视抽查保温杯钢印造假的讨论位居知乎前列。适合消费、家居和科普创作者围绕标签、材质说明、检测报告和购买凭证讲核验方法；涉及具体产品风险或合格判断时应引用监管抽检原文。","category":"消费与家居","momentum":"rising","urgency":"today","heat":88,"crossPlatform":1,"mathFit":93,"visualFit":82,"lifeFit":94,"questionDensity":95,"priority":91,"platforms":[{"id":"zhihu","rank":2,"score":99,"trend":"热议"}],"keywords":["保温杯","钢印","材质","抽检","消费核验"],"mathAngles":["把商品页、标签、报告与凭证组成证据链","区分营销术语与标准化字段","教观众保留批次与购买信息"],"hooks":["一个304钢印，为什么不能只靠肉眼相信","买杯子前，先看懂这四个信息"],"recommendedFormat":{"duration":"45–70 秒","structure":"争议提问 → 证据链 → 监管信息入口"},"factStatus":"needs-review","sources":[{"name":"知乎热榜：保温杯钢印造假","url":"https://www.zhihu.com/question/2077321081388647459","type":"platform"}],"updatedAt":"2026-09-02T16:07:00.000Z"},
    {"id":"teachers-transition-to-middle-school","rank":5,"title":"小学老师转教初中：教育变化怎样讲得不焦虑","brief":"“多地小学老师转教初中”位居百度榜首。教育、城市观察和职场创作者可从生源、学段需求、教师培训和个人适应切入，避免把一条热榜概括为全国性结论。","category":"教育与社会","momentum":"peak","urgency":"today","heat":89,"crossPlatform":1,"mathFit":91,"visualFit":76,"lifeFit":91,"questionDensity":95,"priority":90,"platforms":[{"id":"baidu","rank":1,"score":100,"trend":"高位"}],"keywords":["教师","小学","初中","教育资源"],"mathAngles":["把学生规模、班额、课程与培训列为解释变量","用访谈呈现地区和学科差异","分清趋势判断与个案故事"],"hooks":["老师从小学转到初中，改变的到底是什么","别急着下结论，先看这四个变量"],"recommendedFormat":{"duration":"50–80 秒","structure":"热榜提问 → 四变量解释 → 地方信息提示"},"factStatus":"needs-review","sources":[{"name":"百度热榜：多地小学老师转教初中","url":"https://m.baidu.com/s?word=%E5%A4%9A%E5%9C%B0%E5%B0%8F%E5%AD%A6%E8%80%81%E5%B8%88%E8%BD%AC%E6%95%99%E5%88%9D%E4%B8%AD&sa=fyb_news","type":"platform"}],"updatedAt":"2026-09-02T16:07:00.000Z"},
    {"id":"phone-launch-purchase-timing","rank":6,"title":"手机新品扎堆：别被发布会节奏带着走","brief":"手机涨价与九月发布会撞档的讨论分布在微博、知乎、百度和B站。消费数码创作者可从预算、旧机状态、刚需时间和真实价格四项做决策内容；型号、售价和促销规则须以厂商公开信息为准。","category":"消费与数码","momentum":"rising","urgency":"today","heat":90,"crossPlatform":4,"mathFit":94,"visualFit":85,"lifeFit":96,"questionDensity":93,"priority":91,"platforms":[{"id":"zhihu","rank":7,"score":93,"trend":"热议"},{"id":"baidu","rank":21,"score":76,"trend":"讨论"},{"id":"weibo","rank":43,"score":53,"trend":"讨论"},{"id":"bilibili","rank":25,"score":72,"trend":"讨论"}],"keywords":["手机","发布会","涨价","换机"],"mathAngles":["用预算、旧机维修、等待成本和保值做决策卡","区分发布会信息、零售报价与热搜情绪","列出马上买、继续等和先维修三条路径"],"hooks":["新品扎堆时，最贵的可能不是手机","别先看发布会，先算这四笔账"],"recommendedFormat":{"duration":"50–75 秒","structure":"发布季引子 → 四项判断 → 行动路径"},"factStatus":"needs-review","sources":[{"name":"知乎热榜：苹果小米华为发布时间撞档","url":"https://www.zhihu.com/question/2078445037713450579","type":"platform"},{"name":"B站热门：手机竞争讨论","url":"https://www.bilibili.com/video/BV1Pmtu6gEzU","type":"platform"}],"updatedAt":"2026-09-02T16:07:00.000Z"},
    {"id":"pocket-air-conditioner-demand","rank":7,"title":"口袋空调卖爆：小家电爆款如何看真实需求","brief":"“口袋空调卖爆了”位居百度热榜第二。消费与生活方式创作者可比较使用场景、续航、噪声、制冷感受和退换成本，而非把热搜热度等同于所有用户的购买建议。","category":"消费与生活","momentum":"peak","urgency":"today","heat":84,"crossPlatform":1,"mathFit":88,"visualFit":89,"lifeFit":91,"questionDensity":88,"priority":86,"platforms":[{"id":"baidu","rank":2,"score":99,"trend":"高位"}],"keywords":["口袋空调","小家电","消费","使用场景"],"mathAngles":["将续航、噪声、重量和场景列成对比表","区分体感、参数和广告表述","让不同用户展示实际限制"],"hooks":["口袋空调真能解决热吗","爆款小家电，先问这四个问题"],"recommendedFormat":{"duration":"35–60 秒","structure":"热榜开场 → 对比表 → 适用人群"},"factStatus":"needs-review","sources":[{"name":"百度热榜：口袋空调卖爆","url":"https://m.baidu.com/s?word=%E2%80%9C%E5%8F%A3%E8%A2%8B%E7%A9%BA%E8%B0%83%E2%80%9D%E5%8D%96%E7%88%86%E4%BA%86&sa=fyb_news","type":"platform"}],"updatedAt":"2026-09-02T16:07:00.000Z"},
    {"id":"textbook-new-lesson-story","rank":8,"title":"语文教材新增课文：怎样做一条不剧透的共读内容","brief":"人教版语文教材新增课文进入百度热榜。教育、阅读和亲子创作者可围绕文本如何进入课堂、孩子如何共读和教师如何设计讨论制作内容；教材版本、篇目和适用年级应以出版社或学校正式信息为准。","category":"阅读与教育","momentum":"rising","urgency":"today","heat":81,"crossPlatform":1,"mathFit":87,"visualFit":83,"lifeFit":90,"questionDensity":85,"priority":83,"platforms":[{"id":"baidu","rank":5,"score":95,"trend":"高位"}],"keywords":["语文教材","课文","阅读","课堂"],"mathAngles":["把文本、问题、朗读和延伸活动做成四步共读卡","区分教材原文、教学建议与个人感受","邀请孩子说出自己的阅读入口"],"hooks":["一篇新课文，怎么让孩子愿意先读第一段","别急着讲答案，先试这个共读方法"],"recommendedFormat":{"duration":"40–65 秒","structure":"课文引子 → 共读四步 → 版本核对提醒"},"factStatus":"needs-review","sources":[{"name":"百度热榜：人教版语文教材新增课文","url":"https://m.baidu.com/s?word=%E4%BA%BA%E6%95%99%E7%89%88%E8%AF%AD%E6%96%87%E6%95%99%E6%9D%90%E6%96%B0%E5%A2%9E%E8%BF%99%E7%AF%87%E8%AF%BE%E6%96%87&sa=fyb_news","type":"platform"}],"updatedAt":"2026-09-02T16:07:00.000Z"}
  ]
}
